date,title,description,text
2025-12-02,"Big Tech’s ‘Spend Little, Earn Lots’ Formula Is Threatened By AI","A handful of behemoths like Alphabet Inc., Amazon.com Inc., Meta Platforms Inc. and Microsoft Corp. used this formula to seize market share from legacy...","Big Tech’s ‘Spend Little, Earn Lots’ Formula Is Threatened By AI. A handful of behemoths like Alphabet Inc., Amazon.com Inc., Meta Platforms Inc. and Microsoft Corp. used this formula to seize market share from legacy..."
2025-12-02,Is Truist Financial Stock Underperforming the S&P 500?,,Is Truist Financial Stock Underperforming the S&P 500?.
2025-12-02,OnePlus Pad Go 2: Affordable tablet makes Geekbench debut with mid-range MediaTek SoC,"OnePlus' upcoming Pad Go 2 tablet has shown up on Geekbench. It is powered by a mid-range, 5G-ready MediaTek SoC and 8 GB RAM.","OnePlus Pad Go 2: Affordable tablet makes Geekbench debut with mid-range MediaTek SoC. OnePlus' upcoming Pad Go 2 tablet has shown up on Geekbench. It is powered by a mid-range, 5G-ready MediaTek SoC and 8 GB RAM."
2025-12-02,2 under-the-radar AI stock picks from a fund manager beating 99% of peers over the last 5 years,Ryan Kelley has beaten 99% of peers over the last five years managing two funds. Here are his top under-the-radar names in the AI trade.,2 under-the-radar AI stock picks from a fund manager beating 99% of peers over the last 5 years. Ryan Kelley has beaten 99% of peers over the last five years managing two funds. Here are his top under-the-radar names in the AI trade.
2025-12-02,Bitcoin battles $50K price target as Fed adds $13.5B overnight liquidity,"Bitcoin liquidity cues received a clear signal from the Fed, as the end of QT sparked the second-largest overnight liquidity injection since the COVID-19 era.","Bitcoin battles $50K price target as Fed adds $13.5B overnight liquidity. Bitcoin liquidity cues received a clear signal from the Fed, as the end of QT sparked the second-largest overnight liquidity injection since the COVID-19 era."
2025-12-02,Bitcoin Live News Today: Latest Insights for Bitcoin Maxis (December 2),"Stay Ahead with Our Immediate Analysis of Today’s Bitcoin Insights Check out our Live Bitcoin Updates for December 2, 2025! In 2010, Bitcoin was worth a few cents. One year later, it hit $20. In six years, it was $17,000, and only a month ago, it hit an ATH o…","Bitcoin Live News Today: Latest Insights for Bitcoin Maxis (December 2). Stay Ahead with Our Immediate Analysis of Today’s Bitcoin Insights Check out our Live Bitcoin Updates for December 2, 2025! In 2010, Bitcoin was worth a few cents. One year later, it hit $20. In six years, it was $17,000, and only a month ago, it hit an ATH o…"
2025-12-02,S&P Global Ratings upgrades outlook on Vedanta Resources to 'positive' from 'stable',"S&P Global Ratings has upgraded Vedanta Resources' rating outlook from 'stable' to 'positive', while affirming its senior unsecured notes rating at 'B'. The upgrade reflects Vedanta’s timely ramp-up of aluminium facilities, which will enhance cost efficiency,…","S&P Global Ratings upgrades outlook on Vedanta Resources to 'positive' from 'stable'. S&P Global Ratings has upgraded Vedanta Resources' rating outlook from 'stable' to 'positive', while affirming its senior unsecured notes rating at 'B'. The upgrade reflects Vedanta’s timely ramp-up of aluminium facilities, which will enhance cost efficiency,…"
2025-12-02,Amelia Gray answers the dA-Zed quiz,"The ‘born and bred’ Los Angelino dishes on Rachel Sennott’s I Love LA, curating her perfect wardrobe for Miu Miu, and her mom’s most major Housewives moment","Amelia Gray answers the dA-Zed quiz. The ‘born and bred’ Los Angelino dishes on Rachel Sennott’s I Love LA, curating her perfect wardrobe for Miu Miu, and her mom’s most major Housewives moment"
2025-12-02,Monthly News – November 2025,"Many thanks to our donors, sponsors and to all the people who support our project. Cinnamon Menu The new Cinnamon menu received symbolic category icons. This was made possible thanks to the new XApp Symbolic Icons (XSI) initiative. Linux Mint 22.3 ‘Zena’ The …","Monthly News – November 2025. Many thanks to our donors, sponsors and to all the people who support our project. Cinnamon Menu The new Cinnamon menu received symbolic category icons. This was made possible thanks to the new XApp Symbolic Icons (XSI) initiative. Linux Mint 22.3 ‘Zena’ The …"
2025-12-02,"Billionaire Ken Griffin Buys an Index Fund That's Crushing Bitcoin, Nvidia, and the S&P 500 in 2025","Key Points
-
Billionaire Ken Griffin runs Citadel Advisors, the most successful hedge funds in history as measured by net gains since inception.
-
In the third quarter, Griffin started a position in the SPDR Gold Shares ETF, a fund that has returned 60% year …","Billionaire Ken Griffin Buys an Index Fund That's Crushing Bitcoin, Nvidia, and the S&P 500 in 2025. Key Points
-
Billionaire Ken Griffin runs Citadel Advisors, the most successful hedge funds in history as measured by net gains since inception.
-
In the third quarter, Griffin started a position in the SPDR Gold Shares ETF, a fund that has returned 60% year …"
2025-12-02,Stock Futures Rise as Markets Fight Back From Rocky Start to December,"The U.S. stock market was set to recover from its rocky start to December continued Tuesday with futures rising. Bitcoin, Ethereum and other cryptocurrencies were also under pressure.","Stock Futures Rise as Markets Fight Back From Rocky Start to December. The U.S. stock market was set to recover from its rocky start to December continued Tuesday with futures rising. Bitcoin, Ethereum and other cryptocurrencies were also under pressure."
2025-12-02,Diddy vs Fiddy: A 25-year timeline of one of rap’s biggest feuds,50 Cent and on-trial rival once partnered but have warred over everything from artist contracts to vodka labels... and even Biggie’s murder,Diddy vs Fiddy: A 25-year timeline of one of rap’s biggest feuds. 50 Cent and on-trial rival once partnered but have warred over everything from artist contracts to vodka labels... and even Biggie’s murder
2025-12-02,"U.S. stock futures slip today: Dow, S&P 500 and Nasdaq edge lower — Is tech weakness and Bitcoin volatility dragging Wall Street down?","U.S. stock futures slipped early Tuesday as tech weakness and Bitcoin volatility hit sentiment. Dow futures hovered near 47,345, S&P 500 near 6,827, and Nasdaq around 25,408. The 10-year yield eased to 4.08%. Oil rose to $59.51. Gold fell toward $4,210. Asia …","U.S. stock futures slip today: Dow, S&P 500 and Nasdaq edge lower — Is tech weakness and Bitcoin volatility dragging Wall Street down?. U.S. stock futures slipped early Tuesday as tech weakness and Bitcoin volatility hit sentiment. Dow futures hovered near 47,345, S&P 500 near 6,827, and Nasdaq around 25,408. The 10-year yield eased to 4.08%. Oil rose to $59.51. Gold fell toward $4,210. Asia …"
2025-12-02,Tether Gets Junked By S&P,,Tether Gets Junked By S&P.
