date,title,description,text
2025-12-02,RIN1 regulates developmental and pain-related plasticity in spinal synapses via NMDA receptor subunit trafficking,"Modifications in the subunit composition of NMDA receptors are important for regulating synaptic function, but how are these changes controlled? This study in mice shows that the protein RIN1 differentially regulates the localization of GluN2B and GluN2A rece…","RIN1 regulates developmental and pain-related plasticity in spinal synapses via NMDA receptor subunit trafficking. Modifications in the subunit composition of NMDA receptors are important for regulating synaptic function, but how are these changes controlled? This study in mice shows that the protein RIN1 differentially regulates the localization of GluN2B and GluN2A rece…"
2025-12-02,The effects of ideology and cognitive reflection on evidence gathering behavior in the political domain,"This paper explores individual-level standards of evidence in the political domain. In particular, we examine why people rely on different types of evidence in their evaluations of causal claims. Our empirical analysis is based on original survey data collect…","The effects of ideology and cognitive reflection on evidence gathering behavior in the political domain. This paper explores individual-level standards of evidence in the political domain. In particular, we examine why people rely on different types of evidence in their evaluations of causal claims. Our empirical analysis is based on original survey data collect…"
2025-12-02,"Frechet-power function distribution:Theory, properties and applications","We propose the Fréchet–Power Function (FPF) distribution, a novel two-parameter model that combines the bounded support of the Power Function distribution with the heavy-tailed flexibility of a Fréchet-type generator. This combination enables the FPF to captu…","Frechet-power function distribution:Theory, properties and applications. We propose the Fréchet–Power Function (FPF) distribution, a novel two-parameter model that combines the bounded support of the Power Function distribution with the heavy-tailed flexibility of a Fréchet-type generator. This combination enables the FPF to captu…"
2025-12-02,Hospital-based care for hallucinogens and risk of mania and bipolar disorder: A population-based cohort study,"Using a population-based cohort study, Daniel Myran and colleagues report that emergency or hospital care after hallucinogen use was associated with an increased risk of incident mania or bipolar disorder diagnosis.","Hospital-based care for hallucinogens and risk of mania and bipolar disorder: A population-based cohort study. Using a population-based cohort study, Daniel Myran and colleagues report that emergency or hospital care after hallucinogen use was associated with an increased risk of incident mania or bipolar disorder diagnosis."
2025-12-02,Pave Finance integrates with Morningstar,"Pave Finance, Inc. (“Pave”), the next-generation wealth management platform, has today announced its integration with Morningstar, one of the world’s largest investment research and data providers used by registered investment advisors (RIAs).","Pave Finance integrates with Morningstar. Pave Finance, Inc. (“Pave”), the next-generation wealth management platform, has today announced its integration with Morningstar, one of the world’s largest investment research and data providers used by registered investment advisors (RIAs)."
2025-12-02,Is D.R. Horton Stock Underperforming the S&P 500?,,Is D.R. Horton Stock Underperforming the S&P 500?.
2025-12-02,What Makes Flywire Corporation (FLYW) a Significant Buying Opportunity?,"Voss Capital, LLC, an investment management company, released its third-quarter 2025 investor letter. A copy of the letter can be downloaded here. Voss...","What Makes Flywire Corporation (FLYW) a Significant Buying Opportunity?. Voss Capital, LLC, an investment management company, released its third-quarter 2025 investor letter. A copy of the letter can be downloaded here. Voss..."
2025-12-02,Pakistan again claims of downing Indian jets during May conflict,"Pakistan's Air Chief, Zaheer Ahmed Baber Sindhu, made unsubstantiated claims about shooting down Indian aircraft and defense systems. He stated Pakistani forces neutralized India's S-400 air defense system and command centers. These assertions follow previous…","Pakistan again claims of downing Indian jets during May conflict. Pakistan's Air Chief, Zaheer Ahmed Baber Sindhu, made unsubstantiated claims about shooting down Indian aircraft and defense systems. He stated Pakistani forces neutralized India's S-400 air defense system and command centers. These assertions follow previous…"
2025-12-02,What Makes United Parks & Resorts (PRKS) a Deep Value Stock?,"Voss Capital, LLC, an investment management company, released its third-quarter 2025 investor letter. A copy of the letter can be downloaded here. Voss...","What Makes United Parks & Resorts (PRKS) a Deep Value Stock?. Voss Capital, LLC, an investment management company, released its third-quarter 2025 investor letter. A copy of the letter can be downloaded here. Voss..."
2025-12-02,Voss Capital’s Updates on Xponential Fitness (XPOF),"Voss Capital, LLC, an investment management company, released its third-quarter 2025 investor letter. A copy of the letter can be downloaded here. Voss...","Voss Capital’s Updates on Xponential Fitness (XPOF). Voss Capital, LLC, an investment management company, released its third-quarter 2025 investor letter. A copy of the letter can be downloaded here. Voss..."
2025-12-02,Dell family to give $6.25 billion to create 25 million additional 'Trump Accounts',"Tech billionaires Michael and Susan Dell are pledging $6.25 billion to create 25 million additional ""Trump Accounts"" for children across the country.","Dell family to give $6.25 billion to create 25 million additional 'Trump Accounts'. Tech billionaires Michael and Susan Dell are pledging $6.25 billion to create 25 million additional ""Trump Accounts"" for children across the country."
2025-12-02,Crypto’s Retail Traders Hit Hard as Strategy ETFs Plunge 80%,Strategy Inc. — the company once hailed for wrapping crypto exposure into a public stock — is scrambling to calm markets after its shares plunged more than...,Crypto’s Retail Traders Hit Hard as Strategy ETFs Plunge 80%. Strategy Inc. — the company once hailed for wrapping crypto exposure into a public stock — is scrambling to calm markets after its shares plunged more than...
2025-12-02,Long game pays off as gold surpasses S&P 500 performance over 30 years,"Gold price forecast: Gold’s 30-year surge just beat the S&P 500: Gold has soared. Since 2000, it grew nearly 10 times in value. The S&P 500 rose only 4.34 times. Investors who held gold more than doubled stock market returns. Between 2004–2024, gold returned …","Long game pays off as gold surpasses S&P 500 performance over 30 years. Gold price forecast: Gold’s 30-year surge just beat the S&P 500: Gold has soared. Since 2000, it grew nearly 10 times in value. The S&P 500 rose only 4.34 times. Investors who held gold more than doubled stock market returns. Between 2004–2024, gold returned …"
2025-12-02,Voss Capital is Optimistic on Five9 (FIVN). Here’s Why,"Voss Capital, LLC, an investment management company, released its third-quarter 2025 investor letter. A copy of the letter can be downloaded here. Voss...","Voss Capital is Optimistic on Five9 (FIVN). Here’s Why. Voss Capital, LLC, an investment management company, released its third-quarter 2025 investor letter. A copy of the letter can be downloaded here. Voss..."
2025-12-02,S&P Select Materials SPDR: Pivot points,"See the rest of the story here.

thefly.com provides the latest financial news as it breaks. Known as a leader in market intelligence, The Fly's real-time, streaming news feed keeps individual investors, professional money managers, active traders, and corpor…","S&P Select Materials SPDR: Pivot points. See the rest of the story here.

thefly.com provides the latest financial news as it breaks. Known as a leader in market intelligence, The Fly's real-time, streaming news feed keeps individual investors, professional money managers, active traders, and corpor…"
2025-12-02,"Peter Schiff blasts Trump’s ‘booming economy’ claim, warns US output is ‘going bust.’ Here’s the problem and what to do",The national debt is now nearing $38.5T.,"Peter Schiff blasts Trump’s ‘booming economy’ claim, warns US output is ‘going bust.’ Here’s the problem and what to do. The national debt is now nearing $38.5T."
2025-12-02,"Apple's AI leadership, Costco's tariff lawsuit, Cyber Monday Shopify outage and more in Morning Squawk",Here are five key things investors need to know to start the trading day.,"Apple's AI leadership, Costco's tariff lawsuit, Cyber Monday Shopify outage and more in Morning Squawk. Here are five key things investors need to know to start the trading day."
2025-12-02,SPDR S&P 500 ETF Trust: Pivot points,"See the rest of the story here.

thefly.com provides the latest financial news as it breaks. Known as a leader in market intelligence, The Fly's real-time, streaming news feed keeps individual investors, professional money managers, active traders, and corpor…","SPDR S&P 500 ETF Trust: Pivot points. See the rest of the story here.

thefly.com provides the latest financial news as it breaks. Known as a leader in market intelligence, The Fly's real-time, streaming news feed keeps individual investors, professional money managers, active traders, and corpor…"
2025-12-02,Morgan Stanley Sees More Balanced Risk/Reward for Donaldson (DCI),"Donaldson Company, Inc. (NYSE:DCI) is included among the 15 High Quality Dividend Stocks for Long-Term Investors. O‌n November 24⁠, Morgan Stanley raised its ...","Morgan Stanley Sees More Balanced Risk/Reward for Donaldson (DCI). Donaldson Company, Inc. (NYSE:DCI) is included among the 15 High Quality Dividend Stocks for Long-Term Investors. O‌n November 24⁠, Morgan Stanley raised its ..."
2025-12-02,"The Stock Market Is Doing Something Last Seen When the Dot-Com Bubble Popped, and It's Sending a Clear Signal Where to Invest Now","The Stock Market Is Doing Something Last Seen When the Dot-Com Bubble Popped, and It's Sending a Clear Signal Where to Invest Now
Key Points
-
The S&P 500 has seen its valuation climb amid investor optimism about the potential for AI.
-
Not every company's st…","The Stock Market Is Doing Something Last Seen When the Dot-Com Bubble Popped, and It's Sending a Clear Signal Where to Invest Now. The Stock Market Is Doing Something Last Seen When the Dot-Com Bubble Popped, and It's Sending a Clear Signal Where to Invest Now
Key Points
-
The S&P 500 has seen its valuation climb amid investor optimism about the potential for AI.
-
Not every company's st…"
2025-12-02,BEST SONGS OF 2025,"Voilà and please enjoy - for the 21st time - Said the Gramophone's favourite songs of the year. One hundred remedies for the year two thousand twenty-five: selected by me, Sean, up in Montreal. Songs I love more than demon-hunters,...","BEST SONGS OF 2025. Voilà and please enjoy - for the 21st time - Said the Gramophone's favourite songs of the year. One hundred remedies for the year two thousand twenty-five: selected by me, Sean, up in Montreal. Songs I love more than demon-hunters,..."
2025-12-02,"If You Invested $10K In Pfizer Stock 10 Years Ago, How Much Would You Have Now?","Pfizer Inc. (NYSE:PFE) is a global biopharmaceutical company that discovers, develops, manufactures, and markets medicines, vaccines, and healthcare products...","If You Invested $10K In Pfizer Stock 10 Years Ago, How Much Would You Have Now?. Pfizer Inc. (NYSE:PFE) is a global biopharmaceutical company that discovers, develops, manufactures, and markets medicines, vaccines, and healthcare products..."
2025-12-02,Michael Dell and his wife are pledging $6.25 billion to help fund Invest America accounts for 25 million American children,Dell spoke with Fortune about his philosophy of giving—and how this gift could cover nearly 80% of kids in the U.S.,Michael Dell and his wife are pledging $6.25 billion to help fund Invest America accounts for 25 million American children. Dell spoke with Fortune about his philosophy of giving—and how this gift could cover nearly 80% of kids in the U.S.
2025-12-02,Bangladesh win final T20 clash to wrap up series win over Ireland,Tanzid Hasan’s unbeaten half-century guided the hosts to a comfortable eight-wicket win in Chattogram,Bangladesh win final T20 clash to wrap up series win over Ireland. Tanzid Hasan’s unbeaten half-century guided the hosts to a comfortable eight-wicket win in Chattogram
2025-12-02,"S&P 500 Futures Up in Premarket Trading; MongoDB, Credo Tech Group Lead",,"S&P 500 Futures Up in Premarket Trading; MongoDB, Credo Tech Group Lead."
2025-12-02,What is GivingTuesday? How to donate on the annual day of charitable giving,"Since it started as a hashtag in 2012, GivingTuesday, has become one of the biggest fundraising days of the year for nonprofits in the U.S.","What is GivingTuesday? How to donate on the annual day of charitable giving. Since it started as a hashtag in 2012, GivingTuesday, has become one of the biggest fundraising days of the year for nonprofits in the U.S."
2025-12-02,What is GivingTuesday? How to donate on the annual day of charitable giving,"Since it started as a hashtag in 2012, GivingTuesday, has become one of the biggest fundraising days of the year for nonprofits in the U.S.","What is GivingTuesday? How to donate on the annual day of charitable giving. Since it started as a hashtag in 2012, GivingTuesday, has become one of the biggest fundraising days of the year for nonprofits in the U.S."
2025-12-02,What is GivingTuesday? How to donate on the annual day of charitable giving,"Since it started as a hashtag in 2012, GivingTuesday, has become one of the biggest fundraising days of the year for nonprofits in the U.S.","What is GivingTuesday? How to donate on the annual day of charitable giving. Since it started as a hashtag in 2012, GivingTuesday, has become one of the biggest fundraising days of the year for nonprofits in the U.S."
2025-12-02,Tether CEO Slams S&P Ratings Agency And Influencers Spreading USDt FUD,"Tether CEO Slams S&P Ratings Agency And Influencers Spreading USDt FUD
 
Authored by Vince Quill via CoinTelegraph.com,
Tether CEO Paolo Ardoino and market analysts pushed back against S&P Global’s downgraded rating of USDt’s ability to maintain its US dollar…","Tether CEO Slams S&P Ratings Agency And Influencers Spreading USDt FUD. Tether CEO Slams S&P Ratings Agency And Influencers Spreading USDt FUD
 
Authored by Vince Quill via CoinTelegraph.com,
Tether CEO Paolo Ardoino and market analysts pushed back against S&P Global’s downgraded rating of USDt’s ability to maintain its US dollar…"
2025-12-02,"'Trump Accounts' Are the President's Latest Promise to Hand Americans Cash, But This Time It Might Actually Happen (for Some)","Lest we forget, Trump's history is littered with numerous other ""plans"" to cut checks for Americans that somehow never get across the finish line.","'Trump Accounts' Are the President's Latest Promise to Hand Americans Cash, But This Time It Might Actually Happen (for Some). Lest we forget, Trump's history is littered with numerous other ""plans"" to cut checks for Americans that somehow never get across the finish line."
2025-12-02,On Thin Ice: Crypto Daybook Americas,"Your day-ahead look for Dec. 2, 2025","On Thin Ice: Crypto Daybook Americas. Your day-ahead look for Dec. 2, 2025"
2025-12-02,Fennec Pharmaceuticals Announces Positive Topline Results From Investigator-Initiated Clinical Study of PEDMARK® in Japan to Reduce Cisplatin-Induced Hearing Loss,"– Study, Which Enrolled 27 Patients, Met Primary Endpoint with a Significant Reduction in Hearing Loss in 3-18 Year Old Patients who Received PEDMARK® when Compared with Historically Reported Rates of Hearing Loss in Patients Receiving Cisplatin Alone (16-24%…","Fennec Pharmaceuticals Announces Positive Topline Results From Investigator-Initiated Clinical Study of PEDMARK® in Japan to Reduce Cisplatin-Induced Hearing Loss. – Study, Which Enrolled 27 Patients, Met Primary Endpoint with a Significant Reduction in Hearing Loss in 3-18 Year Old Patients who Received PEDMARK® when Compared with Historically Reported Rates of Hearing Loss in Patients Receiving Cisplatin Alone (16-24%…"
2025-12-02,Morning Bid: Bumpier December,"and global markets today , Editor-At-Large, Finance and Markets Last month showed that 'buy the dip' stock market behavior is alive and well, but Wall Street...","Morning Bid: Bumpier December. and global markets today , Editor-At-Large, Finance and Markets Last month showed that 'buy the dip' stock market behavior is alive and well, but Wall Street..."
2025-12-02,Tech stocks linked to Bitcoin take a battering as crypto traders brace for Strategy to breach danger threshold,"Michael Saylor’s Strategy, the leading Bitcoin treasury company, now has a stock market cap worth less than the Bitcoin it holds.","Tech stocks linked to Bitcoin take a battering as crypto traders brace for Strategy to breach danger threshold. Michael Saylor’s Strategy, the leading Bitcoin treasury company, now has a stock market cap worth less than the Bitcoin it holds."
2025-12-02,Fennec Pharmaceuticals Announces Positive Topline Results From Investigator-Initiated Clinical Study of PEDMARK® in Japan to Reduce Cisplatin-Induced Hearing Loss,"– Study, Which Enrolled 27 Patients, Met Primary Endpoint with a Significant Reduction in Hearing Loss in 3-18 Year Old Patients who Received PEDMARK® when Compared with Historically Reported Rates of Hearing Loss in Patients Receiving Cisplatin Alone (16-24%…","Fennec Pharmaceuticals Announces Positive Topline Results From Investigator-Initiated Clinical Study of PEDMARK® in Japan to Reduce Cisplatin-Induced Hearing Loss. – Study, Which Enrolled 27 Patients, Met Primary Endpoint with a Significant Reduction in Hearing Loss in 3-18 Year Old Patients who Received PEDMARK® when Compared with Historically Reported Rates of Hearing Loss in Patients Receiving Cisplatin Alone (16-24%…"
2025-12-02,OpenEden Closes Strategic Funding as RWA Market Surges; Ripple and Anchorage Digital Ventures Among Backers,"OpenEden has closed a new strategic investment round backed by some of the most influential names in blockchain and institutional finance, including Ripple, Lightspeed Faction, Gate Ventures, FalconX, Anchorage Digital Ventures, Flowdesk, P2 Ventures, Selini …","OpenEden Closes Strategic Funding as RWA Market Surges; Ripple and Anchorage Digital Ventures Among Backers. OpenEden has closed a new strategic investment round backed by some of the most influential names in blockchain and institutional finance, including Ripple, Lightspeed Faction, Gate Ventures, FalconX, Anchorage Digital Ventures, Flowdesk, P2 Ventures, Selini …"
2025-12-02,"Why Is Crypto Up Today? – December 2, 2025","Despite starting the month with a drop, the crypto market is up today, even if slightly, with the cryptocurrency market capitalisation rising by 0.5%, now...","Why Is Crypto Up Today? – December 2, 2025. Despite starting the month with a drop, the crypto market is up today, even if slightly, with the cryptocurrency market capitalisation rising by 0.5%, now..."
2025-12-02,Bitcoin Darling Implodes: $1.5 Billion Vanishes as Strategy's ETF Frenzy Backfires,"Retail traders, leverage, and fading premiums collide in one of the year's most brutal crypto-linked equity meltdowns.","Bitcoin Darling Implodes: $1.5 Billion Vanishes as Strategy's ETF Frenzy Backfires. Retail traders, leverage, and fading premiums collide in one of the year's most brutal crypto-linked equity meltdowns."
2025-12-02,1 Reason Now Is a Great Time to Buy SoFi Stock,"Key Points
-
SoFi continues to add a record number of new users to its platform.
-
Each customer represents years of monetization as they adopt new services.
-
The stock's expensive price tag implies strong market confidence.
With just a month left to the yea…","1 Reason Now Is a Great Time to Buy SoFi Stock. Key Points
-
SoFi continues to add a record number of new users to its platform.
-
Each customer represents years of monetization as they adopt new services.
-
The stock's expensive price tag implies strong market confidence.
With just a month left to the yea…"
2025-12-02,Stock Index Futures Gain as Investors Recover Risk Appetite,"December S&P 500 E-Mini futures (ESZ25) are up +0.27%, and December Nasdaq 100 E-Mini futures (NQZ25) are up +0.39% this morning, signaling a rebound from yesterday’s sell-off on Wall Street as investor risk appetite gradually returns at the start of December…","Stock Index Futures Gain as Investors Recover Risk Appetite. December S&P 500 E-Mini futures (ESZ25) are up +0.27%, and December Nasdaq 100 E-Mini futures (NQZ25) are up +0.39% this morning, signaling a rebound from yesterday’s sell-off on Wall Street as investor risk appetite gradually returns at the start of December…"
2025-12-02,"Hungary PM Orban's Fidesz narrows gap on opposition rival, opinion poll shows","BUDAPEST, Dec 2 (Reuters) - Hungarian Prime Minister Viktor Orban's Fidesz party narrowed the gap on opposition rival Tisza in November, an opinion poll showed on Tuesday, helped by large-scale spending ahead of next year's election and a slight improvement i…","Hungary PM Orban's Fidesz narrows gap on opposition rival, opinion poll shows. BUDAPEST, Dec 2 (Reuters) - Hungarian Prime Minister Viktor Orban's Fidesz party narrowed the gap on opposition rival Tisza in November, an opinion poll showed on Tuesday, helped by large-scale spending ahead of next year's election and a slight improvement i…"
2025-12-02,"2026 will be the year of AI monetization, says Wedbush’s Dan Ives",Most forecasts indicate that both enterprise and overall global AI spending will rise.,"2026 will be the year of AI monetization, says Wedbush’s Dan Ives. Most forecasts indicate that both enterprise and overall global AI spending will rise."
2025-12-02,More 'tug-of-war' between growth and value stocks expected next year,"RBC isn't in the AI bubble camp, but its  analysts say the fears and jitters are not unfounded and make the value vs. growth question interesting in the year...","More 'tug-of-war' between growth and value stocks expected next year. RBC isn't in the AI bubble camp, but its  analysts say the fears and jitters are not unfounded and make the value vs. growth question interesting in the year..."
2025-12-02,"Bare Feet, Grounding, and Health from the Earth Up Through the Body","Bare Feet, Grounding, and Health from the Earth Up Through the Bodythefocalpoints.com","Bare Feet, Grounding, and Health from the Earth Up Through the Body. Bare Feet, Grounding, and Health from the Earth Up Through the Bodythefocalpoints.com"
2025-12-02,A list of mass killings in the United States this year,"The latest mass killing in the United States occurred Saturday when three children ages 8, 9 and 14, and an adult were killed in a shooting at a child’s birthday party in California.","A list of mass killings in the United States this year. The latest mass killing in the United States occurred Saturday when three children ages 8, 9 and 14, and an adult were killed in a shooting at a child’s birthday party in California."
2025-12-02,Why smart CEOs are looking past the rosy ‘record Black Friday’ headlines,Also: All the news and watercooler chat from Fortune.,Why smart CEOs are looking past the rosy ‘record Black Friday’ headlines. Also: All the news and watercooler chat from Fortune.
2025-12-02,"Ripple, leading VCs invest in OpenEden to support the real-world asset tokenisation firm’s expansion",The company will focus on scaling TBILL and the yield-bearing stablecoin USDO. cUSDO was approved this year as off-exchange collateral at Binance. BNY Mellon now manages and safeguards Treasurys underlying TBILL. Real-world asset tokenisation is becoming one …,"Ripple, leading VCs invest in OpenEden to support the real-world asset tokenisation firm’s expansion. The company will focus on scaling TBILL and the yield-bearing stablecoin USDO. cUSDO was approved this year as off-exchange collateral at Binance. BNY Mellon now manages and safeguards Treasurys underlying TBILL. Real-world asset tokenisation is becoming one …"
2025-12-02,"Economy and AI Push Make Shorting US Stocks Dangerous, 22V Says",The commentary lands in a market that had become volatile in recent weeks as investors grew nervous about the impact of tariffs on the economy and monetary...,"Economy and AI Push Make Shorting US Stocks Dangerous, 22V Says. The commentary lands in a market that had become volatile in recent weeks as investors grew nervous about the impact of tariffs on the economy and monetary..."
2025-12-02,"Why the stock market ended lower today? Sensex down 503 pts, Nifty below 26,050. Key factors that dragged D-St lower","Indian equities retreated on Tuesday, with the Sensex and Nifty falling after touching record highs. Investors engaged in profit-taking, while foreign funds continued to reduce their holdings. This combination of domestic selling and external pressures led to…","Why the stock market ended lower today? Sensex down 503 pts, Nifty below 26,050. Key factors that dragged D-St lower. Indian equities retreated on Tuesday, with the Sensex and Nifty falling after touching record highs. Investors engaged in profit-taking, while foreign funds continued to reduce their holdings. This combination of domestic selling and external pressures led to…"
