date,title,description,text
2025-12-02,Meta Platforms (META) Increased Its Capex Estimation in 2026. Here’s Why,"Baron Funds, an investment management company, released its “Baron Fifth Avenue Growth Fund” third-quarter 2025 investor letter. A copy of the letter can be ...","Meta Platforms (META) Increased Its Capex Estimation in 2026. Here’s Why. Baron Funds, an investment management company, released its “Baron Fifth Avenue Growth Fund” third-quarter 2025 investor letter. A copy of the letter can be ..."
2025-12-02,FEMSA Announces Accelerated Share Repurchase Agreement,"MONTERREY, Mexico, Dec. 02, 2025 (GLOBE NEWSWIRE) -- Fomento Económico Mexicano, S.A.B. de C.V. (“FEMSA” or the “Company”) (NYSE: FMX; BMV: FEMSAUBD, FEMSAUB) today announced that, as part of its ongoing efforts and consistent with its capital allocation fram…","FEMSA Announces Accelerated Share Repurchase Agreement. MONTERREY, Mexico, Dec. 02, 2025 (GLOBE NEWSWIRE) -- Fomento Económico Mexicano, S.A.B. de C.V. (“FEMSA” or the “Company”) (NYSE: FMX; BMV: FEMSAUBD, FEMSAUB) today announced that, as part of its ongoing efforts and consistent with its capital allocation fram…"
2025-12-02,What Makes Figma (FIG) a Good Investment Choice?,"Baron Funds, an investment management company, released its “Baron Fifth Avenue Growth Fund” third-quarter 2025 investor letter. A copy of the letter can be ...","What Makes Figma (FIG) a Good Investment Choice?. Baron Funds, an investment management company, released its “Baron Fifth Avenue Growth Fund” third-quarter 2025 investor letter. A copy of the letter can be ..."
2025-12-02,MercadoLibre (MELI) Slid in Q3 Despite Reporting Strong Results,"Baron Funds, an investment management company, released its “Baron Fifth Avenue Growth Fund” third-quarter 2025 investor letter. A copy of the letter can be ...","MercadoLibre (MELI) Slid in Q3 Despite Reporting Strong Results. Baron Funds, an investment management company, released its “Baron Fifth Avenue Growth Fund” third-quarter 2025 investor letter. A copy of the letter can be ..."
2025-12-02,Futures Rebound As Bitcoin Halts Plunge,"Futures Rebound As Bitcoin Halts Plunge
 
After Monday's dismal start to December, US equity futures are higher (if only for the time being), although lacking conviction with few major catalysts on deck today. As of 8:15am, S&P 500 futures are up 0.3% and Nas…","Futures Rebound As Bitcoin Halts Plunge. Futures Rebound As Bitcoin Halts Plunge
 
After Monday's dismal start to December, US equity futures are higher (if only for the time being), although lacking conviction with few major catalysts on deck today. As of 8:15am, S&P 500 futures are up 0.3% and Nas…"
2025-12-02,"I tested the new Sony A7 V, and now it's my favorite Sony camera ever","Bang on cue, the Sony A7 V has arrived and it blurs the lines between enthusiast and pro cameras forever","I tested the new Sony A7 V, and now it's my favorite Sony camera ever. Bang on cue, the Sony A7 V has arrived and it blurs the lines between enthusiast and pro cameras forever"
2025-12-02,Gen Z wants crypto for Christmas. Will their Gen X parents buy it?,"Gen Z wants crypto for Christmas. Crypto is “the new digital stocking stuffer,” Visa announced in a new survey, released Dec. 2.","Gen Z wants crypto for Christmas. Will their Gen X parents buy it?. Gen Z wants crypto for Christmas. Crypto is “the new digital stocking stuffer,” Visa announced in a new survey, released Dec. 2."
2025-12-02,Pharmacokinetic profiles of Moutan Cortex after single and repeated administration in a dinitrobenzene sulfonic acid-induced colitis model,"Moutan Cortex (MC), the dried root bark of Paeonia suffruticosa, is used in traditional Chinese and Korean medicine to treat enteritis for its anti-inflammatory properties. This study compared the pharmacokinetic (PK) profiles of paeonol and paeoniflorin in n…","Pharmacokinetic profiles of Moutan Cortex after single and repeated administration in a dinitrobenzene sulfonic acid-induced colitis model. Moutan Cortex (MC), the dried root bark of Paeonia suffruticosa, is used in traditional Chinese and Korean medicine to treat enteritis for its anti-inflammatory properties. This study compared the pharmacokinetic (PK) profiles of paeonol and paeoniflorin in n…"
2025-12-02,AquaCropPlotter: A Shiny app for visualizing and analyzing AquaCrop simulation results,"AquaCrop, a crop growth model developed by the Food and Agriculture Organization of the United Nations (FAO), can be used as a planning tool to assist management decisions in both irrigated and rainfed agriculture. AquaCrop simulates the yield of crops in res…","AquaCropPlotter: A Shiny app for visualizing and analyzing AquaCrop simulation results. AquaCrop, a crop growth model developed by the Food and Agriculture Organization of the United Nations (FAO), can be used as a planning tool to assist management decisions in both irrigated and rainfed agriculture. AquaCrop simulates the yield of crops in res…"
2025-12-02,Low-dose mixtures of dietary nutrients ameliorate behavioral deficits in multiple mouse models of autism,"Supplementation with individual nutrients can ameliorate autism-related social deficits in mice, but often requires doses that could cause side effects. This study reveals that when administered as a mixture, subtherapeutic doses of these nutrients can act sy…","Low-dose mixtures of dietary nutrients ameliorate behavioral deficits in multiple mouse models of autism. Supplementation with individual nutrients can ameliorate autism-related social deficits in mice, but often requires doses that could cause side effects. This study reveals that when administered as a mixture, subtherapeutic doses of these nutrients can act sy…"
2025-12-02,Development of basic-needs experience and finance-related attitude through game-based learning: The role of game mechanics and debriefing,"Game-based learning (GBL) supports the development of domain-specific competencies, especially knowledge, more effectively than traditional learning methods. However, it is still unclear which elements of GBL positively impact learning outcomes such as motiva…","Development of basic-needs experience and finance-related attitude through game-based learning: The role of game mechanics and debriefing. Game-based learning (GBL) supports the development of domain-specific competencies, especially knowledge, more effectively than traditional learning methods. However, it is still unclear which elements of GBL positively impact learning outcomes such as motiva…"
2025-12-02,From data to diagnosis: An innovative approach to epilepsy prediction with CGTNet incorporating spatio-temporal features,"Epilepsy affects around 50 million people globally, causing significant burdens. While many methods predict seizures, current models struggle with handling spatiotemporal features and balancing accuracy with computational efficiency.This paper introduces a no…","From data to diagnosis: An innovative approach to epilepsy prediction with CGTNet incorporating spatio-temporal features. Epilepsy affects around 50 million people globally, causing significant burdens. While many methods predict seizures, current models struggle with handling spatiotemporal features and balancing accuracy with computational efficiency.This paper introduces a no…"
2025-12-02,How coping styles moderate the relationship between diabetes distress and self-care in adults with diabetes in Appalachian Ohio: A cross-sectional survey study,"Background Diabetes distress is highly prevalent among adults with type 1 and type 2 diabetes, and is associated with fewer self-care behaviors, higher A1C values, increased complications, and lower quality of life. The purpose of this study was to confirm th…","How coping styles moderate the relationship between diabetes distress and self-care in adults with diabetes in Appalachian Ohio: A cross-sectional survey study. Background Diabetes distress is highly prevalent among adults with type 1 and type 2 diabetes, and is associated with fewer self-care behaviors, higher A1C values, increased complications, and lower quality of life. The purpose of this study was to confirm th…"
2025-12-02,Differential contribution of α2δ auxiliary subunits of voltage-gated calcium channels in mouse models of pain and itch,"Voltage-gated calcium channels (VGCCs) are multimeric proteins composed of alpha 1, β and γ subunits, as well as one of four auxiliary α2δ subunits. Although there is considerable preclinical and clinical evidence for a contribution of VGCCs to nociceptive pr…","Differential contribution of α2δ auxiliary subunits of voltage-gated calcium channels in mouse models of pain and itch. Voltage-gated calcium channels (VGCCs) are multimeric proteins composed of alpha 1, β and γ subunits, as well as one of four auxiliary α2δ subunits. Although there is considerable preclinical and clinical evidence for a contribution of VGCCs to nociceptive pr…"
2025-12-02,Ju-LiteMobileAtt: A lightweight attention network for efficient jujube defect classification,"Surface defect detection of organic jujubes is critical for quality assessment. However, conventional machine vision lacks adaptability to polymorphic defects, while deep learning methods face a trade-off—deep architectures are computationally intensive and u…","Ju-LiteMobileAtt: A lightweight attention network for efficient jujube defect classification. Surface defect detection of organic jujubes is critical for quality assessment. However, conventional machine vision lacks adaptability to polymorphic defects, while deep learning methods face a trade-off—deep architectures are computationally intensive and u…"
2025-12-02,Ensuring thermal comfort in the cabin of an electric vehicle at extremely low atmospheric temperatures (down to -45°C),"Ensuring thermal comfort for the driver and passengers in vehicles, including electric vehicles, when traveling on intercity roads, in sparsely populated northern regions with low traffic, in winter, at extremely low atmospheric temperatures is a critical fac…","Ensuring thermal comfort in the cabin of an electric vehicle at extremely low atmospheric temperatures (down to -45°C). Ensuring thermal comfort for the driver and passengers in vehicles, including electric vehicles, when traveling on intercity roads, in sparsely populated northern regions with low traffic, in winter, at extremely low atmospheric temperatures is a critical fac…"
2025-12-02,"Demographic history and population structure of Phlebotomus argentipes (Diptera: Psychodidae) complex, the leishmaniasis vector in Sri Lanka","Phlebotomus argentipes sensu lato Annandale & Brunetti, 1908 is the primary vector of Leishmania donovani MON 37, the causative agent of cutaneous leishmaniasis (CL) in Sri Lanka. Effective vector control is essential for managing leishmaniasis. Although nume…","Demographic history and population structure of Phlebotomus argentipes (Diptera: Psychodidae) complex, the leishmaniasis vector in Sri Lanka. Phlebotomus argentipes sensu lato Annandale & Brunetti, 1908 is the primary vector of Leishmania donovani MON 37, the causative agent of cutaneous leishmaniasis (CL) in Sri Lanka. Effective vector control is essential for managing leishmaniasis. Although nume…"
2025-12-02,Investigating insulin’s role in regulating local aromatase in growth plate development,"Introduction Obesity-associated hyperinsulinemia is hypothesized to disrupt linear growth trajectories, though the mechanisms remain unclear. This study investigates these mechanisms using a high-fat diet-induced rat model.   Methods Twelve healthy 1-week-old…","Investigating insulin’s role in regulating local aromatase in growth plate development. Introduction Obesity-associated hyperinsulinemia is hypothesized to disrupt linear growth trajectories, though the mechanisms remain unclear. This study investigates these mechanisms using a high-fat diet-induced rat model.   Methods Twelve healthy 1-week-old…"
2025-12-02,Association between the neutrophil percentage-to-albumin ratio and pelvic adhesion severity in endometriosis: A retrospective cross-sectional study,"Study background Preoperative assessment of the severity of pelvic adhesions in endometriosis remains challenging. Inflammation may drive adhesion formation, and the predictive value of the neutrophil percentage-to-albumin ratio (NPAR, the ratio multiplied by…","Association between the neutrophil percentage-to-albumin ratio and pelvic adhesion severity in endometriosis: A retrospective cross-sectional study. Study background Preoperative assessment of the severity of pelvic adhesions in endometriosis remains challenging. Inflammation may drive adhesion formation, and the predictive value of the neutrophil percentage-to-albumin ratio (NPAR, the ratio multiplied by…"
2025-12-02,Unhealthy food consumption among 20–59 years old adults in Bangladesh: Findings from a nationally representative cross-sectional survey,"Background Unhealthy food consumption is a major public health concern because of its adverse health consequences. We assessed unhealthy food (savory and fried snacks, SFS; sweet snacks, SS; and sugar-sweetened beverages, SSBs) consumption patterns and identi…","Unhealthy food consumption among 20–59 years old adults in Bangladesh: Findings from a nationally representative cross-sectional survey. Background Unhealthy food consumption is a major public health concern because of its adverse health consequences. We assessed unhealthy food (savory and fried snacks, SFS; sweet snacks, SS; and sugar-sweetened beverages, SSBs) consumption patterns and identi…"
2025-12-02,Community-led polycentric water management for drought mitigation in Southern Zambia,"Recurrent droughts in Southern Zambia have increased rural community vulnerabilities, intensified water scarcity, and worsened food insecurity. Unpredictable rainfall and the drying of open water sources pose significant challenges to livelihoods. In response…","Community-led polycentric water management for drought mitigation in Southern Zambia. Recurrent droughts in Southern Zambia have increased rural community vulnerabilities, intensified water scarcity, and worsened food insecurity. Unpredictable rainfall and the drying of open water sources pose significant challenges to livelihoods. In response…"
2025-12-02,Stillbirth in twin pregnancies in Stockholm County 2000–2021—A descriptive study,"Introduction The incidence of stillbirth is higher in twin pregnancies compared with singleton pregnancies. Known risk factors for stillbirth in twin pregnancies include selective fetal growth restriction, twin-to-twin transfusion syndrome (TTTS) and preeclam…","Stillbirth in twin pregnancies in Stockholm County 2000–2021—A descriptive study. Introduction The incidence of stillbirth is higher in twin pregnancies compared with singleton pregnancies. Known risk factors for stillbirth in twin pregnancies include selective fetal growth restriction, twin-to-twin transfusion syndrome (TTTS) and preeclam…"
2025-12-02,Monocyte-eosinophil signaling axis promotes vaccine-mediated protection against SARS-CoV-2,"Author summary COVID-19 vaccines offer robust protection against severe illness, hospitalization, and death, with vaccine-induced neutralizing antibodies serving as an immune correlate of protection. However, declining antibody levels and the emergence of new…","Monocyte-eosinophil signaling axis promotes vaccine-mediated protection against SARS-CoV-2. Author summary COVID-19 vaccines offer robust protection against severe illness, hospitalization, and death, with vaccine-induced neutralizing antibodies serving as an immune correlate of protection. However, declining antibody levels and the emergence of new…"
2025-12-02,Polo-like kinase 1 regulates growth in juvenile Fasciola hepatica,"Author summary The liver fluke is a parasitic flatworm which causes disease in livestock and humans around the world. While establishing the infection, immature liver fluke migrate through the host liver causing significant damage. Unfortunately, only one dru…","Polo-like kinase 1 regulates growth in juvenile Fasciola hepatica. Author summary The liver fluke is a parasitic flatworm which causes disease in livestock and humans around the world. While establishing the infection, immature liver fluke migrate through the host liver causing significant damage. Unfortunately, only one dru…"
2025-12-02,Age-dependent patterns of cardiac complexity unveiled by topological data analysis of pediatric heart rate variability,"Heart rate variability (HRV) is a well-established marker of autonomic regulation and undergoes profound maturation during early human development. In this study, topological data analysis (TDA) is applied to investigate the evolving geometric complexity of H…","Age-dependent patterns of cardiac complexity unveiled by topological data analysis of pediatric heart rate variability. Heart rate variability (HRV) is a well-established marker of autonomic regulation and undergoes profound maturation during early human development. In this study, topological data analysis (TDA) is applied to investigate the evolving geometric complexity of H…"
2025-12-02,The BrainWaves study of adolescent wellbeing and mental health: Methods development and pilot data,Adolescent mental health and wellbeing are of growing concern globally with increased incidence of mental health disorders in young people. BrainWaves provides a framework for relevant and diverse research programmes into adolescent mental health and wellbein…,The BrainWaves study of adolescent wellbeing and mental health: Methods development and pilot data. Adolescent mental health and wellbeing are of growing concern globally with increased incidence of mental health disorders in young people. BrainWaves provides a framework for relevant and diverse research programmes into adolescent mental health and wellbein…
2025-12-02,"Understanding the trends, clustering, and risk factors of pinworm infection in preschool settings: A repeated cross-sectional multi-center study between 2019 and 2024","Author summary Pinworm infection is among the most prevalent helminth infections in young children worldwide, yet we still lack long-term, multi-center data on how it spreads and whether infections cluster within preschools. Our study aims to chart the trend …","Understanding the trends, clustering, and risk factors of pinworm infection in preschool settings: A repeated cross-sectional multi-center study between 2019 and 2024. Author summary Pinworm infection is among the most prevalent helminth infections in young children worldwide, yet we still lack long-term, multi-center data on how it spreads and whether infections cluster within preschools. Our study aims to chart the trend …"
2025-12-02,"Prevalence and risk factors associated with Taenia solium cysticercosis in pigs in Oyam district, Uganda","Author summary Porcine cysticercosis, caused by the larval stage of the pork tapeworm (Taenia solium), is a zoonotic disease that affects both pigs and humans. In pigs, it reduces economic value, while in humans it can cause taeniosis and cysticercosis, inclu…","Prevalence and risk factors associated with Taenia solium cysticercosis in pigs in Oyam district, Uganda. Author summary Porcine cysticercosis, caused by the larval stage of the pork tapeworm (Taenia solium), is a zoonotic disease that affects both pigs and humans. In pigs, it reduces economic value, while in humans it can cause taeniosis and cysticercosis, inclu…"
2025-12-02,Do we advise as one likes? The alignment bias in social advice giving,"Author summary Among the various forms of opinion exchange, advice stands out for its informational richness and its prevalence in word-of-mouth communication. Our research presents a counterintuitive view, suggesting that advice can be considerably biased—pa…","Do we advise as one likes? The alignment bias in social advice giving. Author summary Among the various forms of opinion exchange, advice stands out for its informational richness and its prevalence in word-of-mouth communication. Our research presents a counterintuitive view, suggesting that advice can be considerably biased—pa…"
2025-12-02,Cross-sectional assessment of Angiostrongylus cantonensis transmission risk mediated by invasive apple snails in Jiangsu province of China,"Author summary In this study, we investigated the risk of human infection with the rat lungworm, Angiostrongylus cantonensis, which can cause severe meningitis. This parasite is often spread through invasive apple snails, which are now widespread in Jiangsu P…","Cross-sectional assessment of Angiostrongylus cantonensis transmission risk mediated by invasive apple snails in Jiangsu province of China. Author summary In this study, we investigated the risk of human infection with the rat lungworm, Angiostrongylus cantonensis, which can cause severe meningitis. This parasite is often spread through invasive apple snails, which are now widespread in Jiangsu P…"
2025-12-02,Ultrasound-based population survey for abdominal cystic echinococcosis in Albania: Results from the NDTND project,"Author summary The paper presents results from a nationwide ultrasound (US)-based survey for Cystic Echinococcosis (CE) carried out in Albania. CE is endemic in the Balkans and is a public health issue in Albania. However, only data available on disease burde…","Ultrasound-based population survey for abdominal cystic echinococcosis in Albania: Results from the NDTND project. Author summary The paper presents results from a nationwide ultrasound (US)-based survey for Cystic Echinococcosis (CE) carried out in Albania. CE is endemic in the Balkans and is a public health issue in Albania. However, only data available on disease burde…"
2025-12-02,Polar cell membrane nanotubes containing microtubules and acidic vesicles render Drosophila eggs fertile,"Membrane nanotubes are cytoskeletal structures that facilitate intercellular communication. This study demonstrates that polar cell derived microtubule nanotubes play a role in Drosophila fertilization, creating a channel in the eggshell that facilitates sper…","Polar cell membrane nanotubes containing microtubules and acidic vesicles render Drosophila eggs fertile. Membrane nanotubes are cytoskeletal structures that facilitate intercellular communication. This study demonstrates that polar cell derived microtubule nanotubes play a role in Drosophila fertilization, creating a channel in the eggshell that facilitates sper…"
2025-12-02,Sustainability logos and claims on food packaging and labels: The case of Türkiye,Enhancing consumer awareness of sustainable nutrition is a key factor in promoting public health and supporting environmentally friendly food systems. Logos and claims on food packaging that indicate the use of sustainable production methods have the potentia…,Sustainability logos and claims on food packaging and labels: The case of Türkiye. Enhancing consumer awareness of sustainable nutrition is a key factor in promoting public health and supporting environmentally friendly food systems. Logos and claims on food packaging that indicate the use of sustainable production methods have the potentia…
2025-12-02,Occupational pesticide exposure and safety assessment among farmers in Hohoe municipality: An ethnographic qualitative study,"Introduction Occupational pesticide exposure poses significant health risks, particularly among smallholder farmers in developing countries like Ghana, where such exposures are common due to widespread subsistence agricultural activities. The Environmental Pr…","Occupational pesticide exposure and safety assessment among farmers in Hohoe municipality: An ethnographic qualitative study. Introduction Occupational pesticide exposure poses significant health risks, particularly among smallholder farmers in developing countries like Ghana, where such exposures are common due to widespread subsistence agricultural activities. The Environmental Pr…"
2025-12-02,"Evaluation of ‘For survivors by survivors’, a cancer survivorship peer support pilot program for healthcare staff: A one-group post-test-only study","Introduction The number of people living with and beyond cancer has risen significantly due to medical advancements. The cancer journey remains physically, socially, and psychologically challenging. Peer support is important in cancer survivorship as it provi…","Evaluation of ‘For survivors by survivors’, a cancer survivorship peer support pilot program for healthcare staff: A one-group post-test-only study. Introduction The number of people living with and beyond cancer has risen significantly due to medical advancements. The cancer journey remains physically, socially, and psychologically challenging. Peer support is important in cancer survivorship as it provi…"
2025-12-02,MiR-125b-5p and miR-100-5p as Biomarkers and therapeutic targets for the prevention of particulate matter-induced non-smoker lung cancer,"Non-smoking-related lung cancer is increasingly associated with environmental factors such as particulate matter (PM) exposure. Using deep small RNA sequencing, we identified distinct miRNA expression patterns in lung cancer patients compared to non-cancer co…","MiR-125b-5p and miR-100-5p as Biomarkers and therapeutic targets for the prevention of particulate matter-induced non-smoker lung cancer. Non-smoking-related lung cancer is increasingly associated with environmental factors such as particulate matter (PM) exposure. Using deep small RNA sequencing, we identified distinct miRNA expression patterns in lung cancer patients compared to non-cancer co…"
